<?xml version="1.0"?>
<!DOCTYPE Report
[
<!ELEMENT Report (General ,(Doc|BPT)) >
<!ATTLIST Report ver CDATA #REQUIRED tmZone CDATA #REQUIRED>

<!ELEMENT General ( DocLocation ) >
<!ATTLIST General productName CDATA #REQUIRED productVer CDATA #REQUIRED os CDATA #REQUIRED host CDATA #REQUIRED qcserver CDATA #IMPLIED qcproject CDATA #IMPLIED SolManSolutionId CDATA #IMPLIED SolManProjectId CDATA #IMPLIED SolManTestPlanId CDATA #IMPLIED SolManTestPackageId CDATA #IMPLIED SolManUserInfoData CDATA #IMPLIED  >

<!ELEMENT BPT (DName,Res,DVer?,TSet?,TInst?,NodeArgs,AdditionalInfo*,Doc*) >
<!ATTLIST BPT rID ID #REQUIRED >

<!ELEMENT Doc (DName,ConfName?,Res,DVer?,TSet?,TInst?,RunType?,DT?,AdditionalInfo*,Step*,DIter*,Step*,Action*,Doc*,Summary?,TestMaintenanceSummary*,NodeArgs?) >
<!ATTLIST Doc rID ID #REQUIRED type (Test|BC|BPTWrapperTest|Flow|Group|Action) "Test" productName CDATA #REQUIRED BCIter CDATA #IMPLIED >

<!ELEMENT RunType ( #PCDATA )>
<!ATTLIST RunType fmStep (False|True) "False" batch (False|True) "False" upDesc (False|True) "False" upChk (False|True) "False" upAS (False|True) "False">

<!ELEMENT DName ( #PCDATA ) >

<!ELEMENT ConfName ( #PCDATA ) >

<!ELEMENT Res ( #PCDATA ) >

<!ELEMENT AdditionalInfo (AdditionalDataName,AdditionalDataValue ) >

<!ELEMENT AdditionalDataName ( #PCDATA ) >

<!ELEMENT AdditionalDataValue ( #PCDATA ) >

<!ELEMENT DVer ( #PCDATA ) >

<!ELEMENT TSet ( #PCDATA ) >

<!ELEMENT TInst ( #PCDATA ) >

<!ELEMENT DIter (Step*,Action+,Summary?,NodeArgs)>
<!ATTLIST DIter rID ID #REQUIRED iterID CDATA #REQUIRED>

<!ELEMENT DocLocation ( #PCDATA )>

<!ELEMENT Action (AName,AIter*,(Step|HtmlStep|Action)*, Summary,ActionMaintenanceSummary*, NodeArgs ) >
<!ATTLIST Action rID ID #REQUIRED>

<!ELEMENT AIter ((Step|HtmlStep|Action)*,DataMapping?, Summary?,NodeArgs) >
<!ATTLIST AIter rID ID #REQUIRED iterID CDATA #REQUIRED isCountable (False|True) "False" >

<!ELEMENT AName ( #PCDATA ) >

<!ELEMENT TestMaintenanceSummary (ActionMaintenanceSummary*) >
<!ATTLIST TestMaintenanceSummary ObjectsAdded CDATA #REQUIRED ObjectsUpdated CDATA #REQUIRED StepsUpdated CDATA #REQUIRED StepsComments CDATA #REQUIRED><!ELEMENT ActionMaintenanceSummary (ObjectChange* ) >
<!ATTLIST ActionMaintenanceSummary Action CDATA #REQUIRED Objects CDATA #REQUIRED Updated CDATA #REQUIRED LinesTotal CDATA #REQUIRED Added CDATA #REQUIRED LinesUpdated CDATA #REQUIRED>

<!ELEMENT ObjectChange  (Hierarchy, PropertyChangeList* ) >
<!ATTLIST ObjectChange Operation CDATA #IMPLIED OriginalRepository CDATA #IMPLIED>

<!ELEMENT PropertyChangeList (PropertyDef*) >

<!ELEMENT PropertyDef (OriginalValue, NewValue) >
<!ATTLIST PropertyDef PropName CDATA #REQUIRED OriginRegularExpression (True|False) "False" NewRegularExpression (True|False) "False" AddedProperty (True|False) "False" >

<!ELEMENT OriginalValue ( #PCDATA )>

<!ELEMENT NewValue ( #PCDATA )>

<!ELEMENT Hierarchy  (ObjectName, Hierarchy*) >
<!ATTLIST Hierarchy MicClass CDATA #REQUIRED>

<!ELEMENT ObjectName  ( #PCDATA ) >

<!ELEMENT Step (Obj,Details,Time,TimeTick* ,(Step|HtmlStep|Doc)*, DataMapping?, NodeArgs) >
<!ATTLIST Step rID ID #REQUIRED retval CDATA #IMPLIED>

<!ELEMENT HtmlStep (HTML,TimeTick*,(Step|HtmlStep|Doc)*,NodeArgs) >
<!ATTLIST HtmlStep rID ID #REQUIRED >

<!ELEMENT Obj ( #PCDATA ) >
<!ATTLIST Obj plainTxt (False|True) "True">

<!ELEMENT Details ( #PCDATA ) >
<!ATTLIST Details plainTxt (False|True) "True">

<!ELEMENT Time ( #PCDATA ) >

<!ELEMENT HTML ( #PCDATA ) >

<!ELEMENT Disp ( #PCDATA ) >

<!ELEMENT TimeTick ( #PCDATA ) >

<!ELEMENT DataMapping ( DataMappedItem* )>
<!ELEMENT DataMappedItem EMPTY >
<!ATTLIST DataMappedItem dsName CDATA #REQUIRED >
<!ATTLIST DataMappedItem rowId CDATA #REQUIRED >

<!ELEMENT NodeArgs (Disp,TopPane?,BtmPane?,ExtendedInfo? )>
<!ATTLIST NodeArgs eType CDATA #REQUIRED icon CDATA #REQUIRED nRep CDATA #REQUIRED UserNote CDATA #IMPLIED filter (False|True) "True">
<!ATTLIST NodeArgs status (Passed|Failed|Done|Warning|Information) "Done">
<!ATTLIST NodeArgs iconSel CDATA #IMPLIED nType CDATA #IMPLIED MovieMarker CDATA "">
<!ATTLIST NodeArgs Source CDATA #IMPLIED SourceLine CDATA #IMPLIED StepFlowItemKey CDATA #IMPLIED >

<!ELEMENT TopPane (Path)>

<!ELEMENT BtmPane ( (Path|WR)?,ASHilite?)>
<!ATTLIST BtmPane vType CDATA "HTML">

<!ELEMENT Path ( #PCDATA ) >

<!ELEMENT ASHilite ( #PCDATA ) >

<!ELEMENT WR ( #PCDATA ) >

<!ELEMENT ExtendedInfo ( StepData ) >

<!ATTLIST ExtendedInfo StepType CDATA #REQUIRED>
<!ELEMENT DT (NodeArgs) >
<!ATTLIST DT rID ID #REQUIRED>

<!ELEMENT Summary (Param*)>
<!ATTLIST Summary sTime CDATA #IMPLIED eTime CDATA #IMPLIED passed CDATA #IMPLIED failed CDATA #IMPLIED warnings CDATA #IMPLIED retval CDATA #IMPLIED stopped (False|True) "False" >

<!ELEMENT Param (ParamName,ParamVal)+ >
<!ATTLIST Param paramInOut (In|Out) "In">

<!ELEMENT ParamName ( #PCDATA ) >

<!ELEMENT ParamVal ( #PCDATA ) >

]
>
<Report ver="2.0" tmZone="Eastern Standard Time">
<General productName="Micro Focus Unified Functional Testing" productVer="15.0.1" os="" host="BLSSTGATST2"><DocLocation><![CDATA[H:\HPA_Test\Test Resources_Claims\Scripts\Claims Smoke Test\TC_001_CLAIMS_SMOKETESTSUITE]]></DocLocation></General>
<Doc rID="T1"   productName= "Micro Focus Unified Functional Testing"  >
<DName><![CDATA[TC_001_CLAIMS_SMOKETESTSUITE]]></DName>
<Res><![CDATA[Report3]]></Res>
<DT rID="T2">
<NodeArgs eType="Table" icon="2" nRep="4" filter="False" >
<Disp><![CDATA[Run-Time Data Table]]></Disp>
<BtmPane vType="Table" >
<Path><![CDATA[Default.xlsx]]></Path>
</BtmPane>
</NodeArgs>
</DT>
<DIter rID="T3" iterID="1" >
<Action rID="T4">
<AName><![CDATA[Action1]]></AName>
<Action rID="T5">
<AName><![CDATA[Action1 [GlobalDriver_Working_Smoke]]]></AName>
<Step rID="T6">
<Obj plainTxt="False" ><![CDATA[LoadFunctionLibrary]]></Obj>
<Details plainTxt="False" ><![CDATA[LoadFunctionLibrary function passed]]></Details>
<Time><![CDATA[5/13/2022 - 10:39:33]]></Time>
<TimeTick>1652452773</TimeTick>
<NodeArgs eType="Replay" icon="6" nRep="9" status="Passed" Source="Action1 [GlobalDriver_Working_Smoke]" SourceLine="151" >
<Disp><![CDATA[LoadFunctionLibrary]]></Disp>
</NodeArgs>
</Step>
<Step rID="T7">
<Obj plainTxt="False" ><![CDATA[LoadFunctionLibrary]]></Obj>
<Details plainTxt="False" ><![CDATA[LoadFunctionLibrary function passed]]></Details>
<Time><![CDATA[5/13/2022 - 10:39:35]]></Time>
<TimeTick>1652452775</TimeTick>
<NodeArgs eType="Replay" icon="6" nRep="10" status="Passed" Source="Action1 [GlobalDriver_Working_Smoke]" SourceLine="153" >
<Disp><![CDATA[LoadFunctionLibrary]]></Disp>
</NodeArgs>
</Step>
<Step rID="T8">
<Obj plainTxt="False" ><![CDATA[LoadFunctionLibrary]]></Obj>
<Details plainTxt="False" ><![CDATA[LoadFunctionLibrary function passed]]></Details>
<Time><![CDATA[5/13/2022 - 10:39:36]]></Time>
<TimeTick>1652452776</TimeTick>
<NodeArgs eType="Replay" icon="6" nRep="11" status="Passed" Source="Action1 [GlobalDriver_Working_Smoke]" SourceLine="154" >
<Disp><![CDATA[LoadFunctionLibrary]]></Disp>
</NodeArgs>
</Step>
<Step rID="T9">
<Obj plainTxt="False" ><![CDATA[LoadFunctionLibrary]]></Obj>
<Details plainTxt="False" ><![CDATA[LoadFunctionLibrary function passed]]></Details>
<Time><![CDATA[5/13/2022 - 10:39:36]]></Time>
<TimeTick>1652452776</TimeTick>
<NodeArgs eType="Replay" icon="6" nRep="12" status="Passed" Source="Action1 [GlobalDriver_Working_Smoke]" SourceLine="155" >
<Disp><![CDATA[LoadFunctionLibrary]]></Disp>
</NodeArgs>
</Step>
<Step rID="T10">
<Obj ><![CDATA[Test Information]]></Obj>
<Details ><![CDATA[datasheetused:CLAIMS_SMOKETESTSUITE.xlsServer Used:hpasstgaweb1]]></Details>
<Time><![CDATA[5/13/2022 - 10:39:36]]></Time>
<TimeTick>1652452776</TimeTick>
<NodeArgs eType="User" icon="7" nRep="13" Source="Action1 [GlobalDriver_Working_Smoke]" SourceLine="167" >
<Disp><![CDATA[Test Information]]></Disp>
</NodeArgs>
</Step>
<Step rID="T11">
<Obj ><![CDATA[Find Row No]]></Obj>
<Details ><![CDATA[Row No ofTC_002_Check version upgrade_in_the_About_tab:909]]></Details>
<Time><![CDATA[5/13/2022 - 10:39:45]]></Time>
<TimeTick>1652452785</TimeTick>
<NodeArgs eType="User" icon="7" nRep="14" status="Passed" Source="Action1 [GlobalDriver_Working_Smoke]" SourceLine="456" >
<Disp><![CDATA[Find Row No]]></Disp>
</NodeArgs>
</Step>
<Step rID="T12">
<Obj ><![CDATA[Find Row No]]></Obj>
<Details ><![CDATA[Row No ofTC_002_Check version upgrade_in_the_About_tab_END:916]]></Details>
<Time><![CDATA[5/13/2022 - 10:39:50]]></Time>
<TimeTick>1652452790</TimeTick>
<NodeArgs eType="User" icon="7" nRep="15" status="Passed" Source="Action1 [GlobalDriver_Working_Smoke]" SourceLine="456" >
<Disp><![CDATA[Find Row No]]></Disp>
</NodeArgs>
</Step>
<Step rID="T13">
<Obj ><![CDATA[Find Row No]]></Obj>
<Details ><![CDATA[Row No ofLOGOFF:7]]></Details>
<Time><![CDATA[5/13/2022 - 10:39:56]]></Time>
<TimeTick>1652452796</TimeTick>
<NodeArgs eType="User" icon="7" nRep="16" status="Passed" Source="Action1 [GlobalDriver_Working_Smoke]" SourceLine="456" >
<Disp><![CDATA[Find Row No]]></Disp>
</NodeArgs>
</Step>
<Step rID="T14">
<Obj ><![CDATA[Find Row No]]></Obj>
<Details ><![CDATA[Row No ofLOGOFF_END:12]]></Details>
<Time><![CDATA[5/13/2022 - 10:40:01]]></Time>
<TimeTick>1652452801</TimeTick>
<NodeArgs eType="User" icon="7" nRep="17" status="Passed" Source="Action1 [GlobalDriver_Working_Smoke]" SourceLine="456" >
<Disp><![CDATA[Find Row No]]></Disp>
</NodeArgs>
</Step>
<Step rID="T15">
<Obj plainTxt="False" ><![CDATA[SystemUtil]]></Obj>
<Details plainTxt="False" ><![CDATA[SystemUtil]]></Details>
<Time><![CDATA[5/13/2022 - 10:40:09]]></Time>
<TimeTick>1652452809</TimeTick>
<Step rID="T16">
<Obj plainTxt="False" ><![CDATA[Run "iexplore.exe",1]]></Obj>
<Details plainTxt="False" ><![CDATA[Run "iexplore.exe",1]]></Details>
<Time><![CDATA[5/13/2022 - 10:40:09]]></Time>
<TimeTick>1652452809</TimeTick>
<NodeArgs eType="Replay" icon="8" nRep="21" status="Passed" >
<Disp><![CDATA[Run "iexplore.exe",1]]></Disp>
</NodeArgs>
</Step>
<NodeArgs eType="Replay" icon="8" nRep="20" status="Passed" >
<Disp><![CDATA[SystemUtil]]></Disp>
</NodeArgs>
</Step>
<Step rID="T17">
<Obj ><![CDATA[Launch application]]></Obj>
<Details ><![CDATA[Application launched successfully:http://hpasstgaweb2.stga.mapshc.com/HPAALL/HPA/Master/Qmain.aspx]]></Details>
<Time><![CDATA[5/13/2022 - 10:40:15]]></Time>
<TimeTick>1652452815</TimeTick>
<NodeArgs eType="User" icon="7" nRep="22" status="Passed" >
<Disp><![CDATA[Launch application]]></Disp>
</NodeArgs>
</Step>
<Step rID="T18">
<Obj ><![CDATA[NA]]></Obj>
<Details ><![CDATA[Succeded at Row No:    1,Value used:http://hpasstgaweb2.stga.mapshc.com/HPAALL/HPA/Master/Qmain.aspx]]></Details>
<Time><![CDATA[5/13/2022 - 10:40:15]]></Time>
<TimeTick>1652452815</TimeTick>
<NodeArgs eType="User" icon="7" nRep="23" Source="Action1 [GlobalDriver_Working_Smoke]" SourceLine="1627" >
<Disp><![CDATA[NA]]></Disp>
</NodeArgs>
</Step>
<Step rID="T19">
<Obj ><![CDATA[NA]]></Obj>
<Details ><![CDATA[Succeded at Row No:    2,Value used:10]]></Details>
<Time><![CDATA[5/13/2022 - 10:40:26]]></Time>
<TimeTick>1652452826</TimeTick>
<NodeArgs eType="User" icon="7" nRep="24" Source="Action1 [GlobalDriver_Working_Smoke]" SourceLine="1627" >
<Disp><![CDATA[NA]]></Disp>
</NodeArgs>
</Step>
<Step rID="T20">
<Obj ><![CDATA[Skip row]]></Obj>
<Details ><![CDATA[You have successfully skipped the row no 1]]></Details>
<Time><![CDATA[5/13/2022 - 10:40:26]]></Time>
<TimeTick>1652452826</TimeTick>
<NodeArgs eType="User" icon="7" nRep="25" Source="Action1 [GlobalDriver_Working_Smoke]" SourceLine="563" >
<Disp><![CDATA[Skip row]]></Disp>
</NodeArgs>
</Step>
<Step rID="T21">
<Obj ><![CDATA[Skip row]]></Obj>
<Details ><![CDATA[You have successfully skipped the row no 1]]></Details>
<Time><![CDATA[5/13/2022 - 10:40:27]]></Time>
<TimeTick>1652452827</TimeTick>
<NodeArgs eType="User" icon="7" nRep="26" Source="Action1 [GlobalDriver_Working_Smoke]" SourceLine="563" >
<Disp><![CDATA[Skip row]]></Disp>
</NodeArgs>
</Step>
<Step rID="T22">
<Obj plainTxt="False" ><![CDATA[Brw_Home_Page]]></Obj>
<Details plainTxt="False" ><![CDATA[<table><tr><td><span style="text-align : left; font-size : 12px; ">Local Browser</span></td></tr></table>]]></Details>
<Time><![CDATA[5/13/2022 - 10:40:27]]></Time>
<TimeTick>1652452827</TimeTick>
<Step rID="T23">
<Obj plainTxt="False" ><![CDATA[Pge_QNXT_Home_Page]]></Obj>
<Details plainTxt="False" ><![CDATA[Page]]></Details>
<Time><![CDATA[5/13/2022 - 10:40:28]]></Time>
<TimeTick>1652452828</TimeTick>
<Step rID="T24">
<Obj plainTxt="False" ><![CDATA[Lst_Working_Env.Exist]]></Obj>
<Details plainTxt="False" ><![CDATA["Object exists"]]></Details>
<Time><![CDATA[5/13/2022 - 10:40:28]]></Time>
<TimeTick>1652452828</TimeTick>
<NodeArgs eType="Replay" icon="11" nRep="30" >
<Disp><![CDATA[Lst_Working_Env.Exist]]></Disp>
<BtmPane vType="Mercury.SSHWeb" >
<Path><![CDATA[ZIP::Act2\Row0\ssf3.xml]]></Path>
<ASHilite><![CDATA[Browser("Brw Home Page").Page("Pge QNXT Home Page").WebList("Lst Working Env")]]></ASHilite>
</BtmPane>
</NodeArgs>
</Step>
<Step rID="T25">
<Obj plainTxt="False" ><![CDATA[Lst_Working_Env.Select]]></Obj>
<Details plainTxt="False" ><![CDATA["HPA-Med/Dent"]]></Details>
<Time><![CDATA[5/13/2022 - 10:40:28]]></Time>
<TimeTick>1652452828</TimeTick>
<NodeArgs eType="Replay" icon="11" nRep="33" >
<Disp><![CDATA[Lst_Working_Env.Select]]></Disp>
<BtmPane vType="Mercury.SSHWeb" >
<Path><![CDATA[ZIP::Act2\Row0\ssf4.xml]]></Path>
<ASHilite><![CDATA[Browser("Brw Home Page").Page("Pge QNXT Home Page").WebList("Lst Working Env")]]></ASHilite>
</BtmPane>
</NodeArgs>
</Step>
<NodeArgs eType="Context" icon="10" nRep="29" >
<Disp><![CDATA[Pge_QNXT_Home_Page]]></Disp>
<BtmPane vType="HTMLSNSH" >
<Path><![CDATA[ZIP::Act2\Row0\ssf2.xml]]></Path>
<ASHilite><![CDATA[Browser("Brw_Home_Page").Page("Pge_QNXT_Home_Page")]]></ASHilite>
</BtmPane>
</NodeArgs>
</Step>
<NodeArgs eType="Context" icon="9" nRep="28" >
<Disp><![CDATA[Brw_Home_Page]]></Disp>
<BtmPane vType="ViewerGen.SSViewerGen" >
<Path><![CDATA[ZIP::Act2\Row0\ssf1.xml]]></Path>
<ASHilite><![CDATA[30279198]]></ASHilite>
</BtmPane>
</NodeArgs>
</Step>
<Step rID="T26">
<Obj ><![CDATA[Working_Env]]></Obj>
<Details ><![CDATA[Succeded at Row No:    5,Value used:HPA-Med/Dent]]></Details>
<Time><![CDATA[5/13/2022 - 10:40:28]]></Time>
<TimeTick>1652452828</TimeTick>
<NodeArgs eType="User" icon="7" nRep="34" Source="Action1 [GlobalDriver_Working_Smoke]" SourceLine="1627" >
<Disp><![CDATA[Working_Env]]></Disp>
</NodeArgs>
</Step>
<Step rID="T27">
<Obj plainTxt="False" ><![CDATA[Brw_Home_Page]]></Obj>
<Details plainTxt="False" ><![CDATA[<table><tr><td><span style="text-align : left; font-size : 12px; ">Local Browser</span></td></tr></table>]]></Details>
<Time><![CDATA[5/13/2022 - 10:40:29]]></Time>
<TimeTick>1652452829</TimeTick>
<Step rID="T28">
<Obj plainTxt="False" ><![CDATA[Pge_QNXT_Home_Page]]></Obj>
<Details plainTxt="False" ><![CDATA[Page]]></Details>
<Time><![CDATA[5/13/2022 - 10:40:29]]></Time>
<TimeTick>1652452829</TimeTick>
<Step rID="T29">
<Obj plainTxt="False" ><![CDATA[Lnk_About.Exist]]></Obj>
<Details plainTxt="False" ><![CDATA["Object exists"]]></Details>
<Time><![CDATA[5/13/2022 - 10:40:29]]></Time>
<TimeTick>1652452829</TimeTick>
<NodeArgs eType="Replay" icon="12" nRep="38" >
<Disp><![CDATA[Lnk_About.Exist]]></Disp>
<BtmPane vType="Mercury.SSHWeb" >
<Path><![CDATA[ZIP::Act2\Row0\ssf7.xml]]></Path>
<ASHilite><![CDATA[Browser("Brw Home Page").Page("Pge QNXT Home Page").Link("Lnk About")]]></ASHilite>
</BtmPane>
</NodeArgs>
</Step>
<Step rID="T30">
<Obj plainTxt="False" ><![CDATA[Lnk_About.Click]]></Obj>
<Details plainTxt="False" ><![CDATA[]]></Details>
<Time><![CDATA[5/13/2022 - 10:40:29]]></Time>
<TimeTick>1652452829</TimeTick>
<NodeArgs eType="Replay" icon="12" nRep="41" >
<Disp><![CDATA[Lnk_About.Click]]></Disp>
<BtmPane vType="Mercury.SSHWeb" >
<Path><![CDATA[ZIP::Act2\Row0\ssf8.xml]]></Path>
<ASHilite><![CDATA[Browser("Brw Home Page").Page("Pge QNXT Home Page").Link("Lnk About")]]></ASHilite>
</BtmPane>
</NodeArgs>
</Step>
<NodeArgs eType="Context" icon="10" nRep="37" >
<Disp><![CDATA[Pge_QNXT_Home_Page]]></Disp>
<BtmPane vType="HTMLSNSH" >
<Path><![CDATA[ZIP::Act2\Row0\ssf6.xml]]></Path>
<ASHilite><![CDATA[Browser("Brw_Home_Page").Page("Pge_QNXT_Home_Page")]]></ASHilite>
</BtmPane>
</NodeArgs>
</Step>
<NodeArgs eType="Context" icon="9" nRep="36" >
<Disp><![CDATA[Brw_Home_Page]]></Disp>
<BtmPane vType="ViewerGen.SSViewerGen" >
<Path><![CDATA[ZIP::Act2\Row0\ssf5.xml]]></Path>
<ASHilite><![CDATA[30279198]]></ASHilite>
</BtmPane>
</NodeArgs>
</Step>
<Step rID="T31">
<Obj ><![CDATA[About]]></Obj>
<Details ><![CDATA[Succeded at Row No:    909,Value used:About]]></Details>
<Time><![CDATA[5/13/2022 - 10:40:30]]></Time>
<TimeTick>1652452830</TimeTick>
<NodeArgs eType="User" icon="7" nRep="42" Source="Action1 [GlobalDriver_Working_Smoke]" SourceLine="1627" >
<Disp><![CDATA[About]]></Disp>
</NodeArgs>
</Step>
<Step rID="T32">
<Obj ><![CDATA[NA]]></Obj>
<Details ><![CDATA[Succeded at Row No:    910,Value used:3]]></Details>
<Time><![CDATA[5/13/2022 - 10:40:34]]></Time>
<TimeTick>1652452834</TimeTick>
<NodeArgs eType="User" icon="7" nRep="43" Source="Action1 [GlobalDriver_Working_Smoke]" SourceLine="1627" >
<Disp><![CDATA[NA]]></Disp>
</NodeArgs>
</Step>
<Step rID="T33">
<Obj plainTxt="False" ><![CDATA[Win_QNXT Homepage_About]]></Obj>
<Details plainTxt="False" ><![CDATA[Window]]></Details>
<Time><![CDATA[5/13/2022 - 10:40:37]]></Time>
<TimeTick>1652452837</TimeTick>
<Step rID="T34">
<Obj plainTxt="False" ><![CDATA[Win_QNXT Homepage_About.Exist]]></Obj>
<Details plainTxt="False" ><![CDATA["Object exists"]]></Details>
<Time><![CDATA[5/13/2022 - 10:40:37]]></Time>
<TimeTick>1652452837</TimeTick>
<NodeArgs eType="Replay" icon="13" nRep="45" >
<Disp><![CDATA[Win_QNXT Homepage_About.Exist]]></Disp>
<BtmPane vType="ViewerGen.SSViewerGen" >
<Path><![CDATA[ZIP::Act2\Row0\ssf10.xml]]></Path>
<ASHilite><![CDATA[9503940]]></ASHilite>
</BtmPane>
</NodeArgs>
</Step>
<Step rID="T35">
<Obj plainTxt="False" ><![CDATA[Win_QNXT Homepage_About.Activate]]></Obj>
<Details plainTxt="False" ><![CDATA[]]></Details>
<Time><![CDATA[5/13/2022 - 10:40:38]]></Time>
<TimeTick>1652452838</TimeTick>
<NodeArgs eType="Replay" icon="13" nRep="47" >
<Disp><![CDATA[Win_QNXT Homepage_About.Activate]]></Disp>
<BtmPane vType="ViewerGen.SSViewerGen" >
<Path><![CDATA[ZIP::Act2\Row0\ssf11.xml]]></Path>
<ASHilite><![CDATA[9503940]]></ASHilite>
</BtmPane>
</NodeArgs>
</Step>
<NodeArgs eType="Context" icon="13" nRep="44" >
<Disp><![CDATA[Win_QNXT Homepage_About]]></Disp>
<BtmPane vType="ViewerGen.SSViewerGen" >
<Path><![CDATA[ZIP::Act2\Row0\ssf9.xml]]></Path>
<ASHilite><![CDATA[9503940]]></ASHilite>
</BtmPane>
</NodeArgs>
</Step>
<Step rID="T36">
<Obj ><![CDATA[Version]]></Obj>
<Details ><![CDATA[Succeded at Row No:    911,Value used:5.0.10.00]]></Details>
<Time><![CDATA[5/13/2022 - 10:40:41]]></Time>
<TimeTick>1652452841</TimeTick>
<NodeArgs eType="User" icon="7" nRep="49" Source="Action1 [GlobalDriver_Working_Smoke]" SourceLine="1627" >
<Disp><![CDATA[Version]]></Disp>
</NodeArgs>
</Step>
<Step rID="T37">
<Obj plainTxt="False" ><![CDATA[Win_QNXT Homepage_About]]></Obj>
<Details plainTxt="False" ><![CDATA[Window]]></Details>
<Time><![CDATA[5/13/2022 - 10:40:42]]></Time>
<TimeTick>1652452842</TimeTick>
<Step rID="T38">
<Obj plainTxt="False" ><![CDATA[Win_QNXT Homepage_About.Exist]]></Obj>
<Details plainTxt="False" ><![CDATA["Object exists"]]></Details>
<Time><![CDATA[5/13/2022 - 10:40:42]]></Time>
<TimeTick>1652452842</TimeTick>
<NodeArgs eType="Replay" icon="13" nRep="51" >
<Disp><![CDATA[Win_QNXT Homepage_About.Exist]]></Disp>
<BtmPane vType="ViewerGen.SSViewerGen" >
<Path><![CDATA[ZIP::Act2\Row0\ssf13.xml]]></Path>
<ASHilite><![CDATA[9503940]]></ASHilite>
</BtmPane>
</NodeArgs>
</Step>
<Step rID="T39">
<Obj plainTxt="False" ><![CDATA[Win_QNXT Homepage_About.Activate]]></Obj>
<Details plainTxt="False" ><![CDATA[]]></Details>
<Time><![CDATA[5/13/2022 - 10:40:42]]></Time>
<TimeTick>1652452842</TimeTick>
<NodeArgs eType="Replay" icon="13" nRep="53" >
<Disp><![CDATA[Win_QNXT Homepage_About.Activate]]></Disp>
<BtmPane vType="ViewerGen.SSViewerGen" >
<Path><![CDATA[ZIP::Act2\Row0\ssf14.xml]]></Path>
<ASHilite><![CDATA[9503940]]></ASHilite>
</BtmPane>
</NodeArgs>
</Step>
<NodeArgs eType="Context" icon="13" nRep="50" >
<Disp><![CDATA[Win_QNXT Homepage_About]]></Disp>
<BtmPane vType="ViewerGen.SSViewerGen" >
<Path><![CDATA[ZIP::Act2\Row0\ssf12.xml]]></Path>
<ASHilite><![CDATA[9503940]]></ASHilite>
</BtmPane>
</NodeArgs>
</Step>
<Step rID="T40">
<Obj ><![CDATA[COMMON_VERIFICATION:Q_I_VALIDATE_WEBELEMENT]]></Obj>
<Details ><![CDATA[WebElement  lblV:innertext=5.0.24.00 matches with expected value 5.0.24.00]]></Details>
<Time><![CDATA[5/13/2022 - 10:40:43]]></Time>
<TimeTick>1652452843</TimeTick>
<NodeArgs eType="User" icon="7" nRep="55" status="Passed" >
<Disp><![CDATA[COMMON_VERIFICATION:Q_I_VALIDATE_WEBELEMENT]]></Disp>
</NodeArgs>
</Step>
<Step rID="T41">
<Obj ><![CDATA[Version]]></Obj>
<Details ><![CDATA[Succeded at Row No:    912,Value used:5.0.24.00]]></Details>
<Time><![CDATA[5/13/2022 - 10:40:43]]></Time>
<TimeTick>1652452843</TimeTick>
<NodeArgs eType="User" icon="7" nRep="56" Source="Action1 [GlobalDriver_Working_Smoke]" SourceLine="1627" >
<Disp><![CDATA[Version]]></Disp>
</NodeArgs>
</Step>
<Step rID="T42">
<Obj plainTxt="False" ><![CDATA[Win_QNXT Homepage_About]]></Obj>
<Details plainTxt="False" ><![CDATA[Window]]></Details>
<Time><![CDATA[5/13/2022 - 10:40:44]]></Time>
<TimeTick>1652452844</TimeTick>
<Step rID="T43">
<Obj plainTxt="False" ><![CDATA[Win_QNXT Homepage_About.Exist]]></Obj>
<Details plainTxt="False" ><![CDATA["Object exists"]]></Details>
<Time><![CDATA[5/13/2022 - 10:40:44]]></Time>
<TimeTick>1652452844</TimeTick>
<NodeArgs eType="Replay" icon="13" nRep="58" >
<Disp><![CDATA[Win_QNXT Homepage_About.Exist]]></Disp>
<BtmPane vType="ViewerGen.SSViewerGen" >
<Path><![CDATA[ZIP::Act2\Row0\ssf16.xml]]></Path>
<ASHilite><![CDATA[9503940]]></ASHilite>
</BtmPane>
</NodeArgs>
</Step>
<Step rID="T44">
<Obj plainTxt="False" ><![CDATA[Win_QNXT Homepage_About.Activate]]></Obj>
<Details plainTxt="False" ><![CDATA[]]></Details>
<Time><![CDATA[5/13/2022 - 10:40:44]]></Time>
<TimeTick>1652452844</TimeTick>
<NodeArgs eType="Replay" icon="13" nRep="60" >
<Disp><![CDATA[Win_QNXT Homepage_About.Activate]]></Disp>
<BtmPane vType="ViewerGen.SSViewerGen" >
<Path><![CDATA[ZIP::Act2\Row0\ssf17.xml]]></Path>
<ASHilite><![CDATA[9503940]]></ASHilite>
</BtmPane>
</NodeArgs>
</Step>
<NodeArgs eType="Context" icon="13" nRep="57" >
<Disp><![CDATA[Win_QNXT Homepage_About]]></Disp>
<BtmPane vType="ViewerGen.SSViewerGen" >
<Path><![CDATA[ZIP::Act2\Row0\ssf15.xml]]></Path>
<ASHilite><![CDATA[9503940]]></ASHilite>
</BtmPane>
</NodeArgs>
</Step>
<Step rID="T45">
<Obj ><![CDATA[NA]]></Obj>
<Details ><![CDATA[Succeded at Row No:    913]]></Details>
<Time><![CDATA[5/13/2022 - 10:40:52]]></Time>
<TimeTick>1652452852</TimeTick>
<NodeArgs eType="User" icon="7" nRep="61" Source="Action1 [GlobalDriver_Working_Smoke]" SourceLine="1625" >
<Disp><![CDATA[NA]]></Disp>
</NodeArgs>
</Step>
<Step rID="T46">
<Obj plainTxt="False" ><![CDATA[Win_QNXT Homepage_About]]></Obj>
<Details plainTxt="False" ><![CDATA[Window]]></Details>
<Time><![CDATA[5/13/2022 - 10:40:53]]></Time>
<TimeTick>1652452853</TimeTick>
<Step rID="T47">
<Obj plainTxt="False" ><![CDATA[Win_QNXT Homepage_About.Exist]]></Obj>
<Details plainTxt="False" ><![CDATA["Object exists"]]></Details>
<Time><![CDATA[5/13/2022 - 10:40:53]]></Time>
<TimeTick>1652452853</TimeTick>
<NodeArgs eType="Replay" icon="13" nRep="63" >
<Disp><![CDATA[Win_QNXT Homepage_About.Exist]]></Disp>
<BtmPane vType="ViewerGen.SSViewerGen" >
<Path><![CDATA[ZIP::Act2\Row0\ssf19.xml]]></Path>
<ASHilite><![CDATA[9503940]]></ASHilite>
</BtmPane>
</NodeArgs>
</Step>
<Step rID="T48">
<Obj plainTxt="False" ><![CDATA[Win_QNXT Homepage_About.Activate]]></Obj>
<Details plainTxt="False" ><![CDATA[]]></Details>
<Time><![CDATA[5/13/2022 - 10:40:53]]></Time>
<TimeTick>1652452853</TimeTick>
<NodeArgs eType="Replay" icon="13" nRep="65" >
<Disp><![CDATA[Win_QNXT Homepage_About.Activate]]></Disp>
<BtmPane vType="ViewerGen.SSViewerGen" >
<Path><![CDATA[ZIP::Act2\Row0\ssf20.xml]]></Path>
<ASHilite><![CDATA[9503940]]></ASHilite>
</BtmPane>
</NodeArgs>
</Step>
<Step rID="T49">
<Obj plainTxt="False" ><![CDATA[Pge_QNXT Homepage_About]]></Obj>
<Details plainTxt="False" ><![CDATA[Page]]></Details>
<Time><![CDATA[5/13/2022 - 10:40:54]]></Time>
<TimeTick>1652452854</TimeTick>
<Step rID="T50">
<Obj plainTxt="False" ><![CDATA[Frm_QNXT Homepage_About]]></Obj>
<Details plainTxt="False" ><![CDATA[Frame]]></Details>
<Time><![CDATA[5/13/2022 - 10:40:54]]></Time>
<TimeTick>1652452854</TimeTick>
<Step rID="T51">
<Obj plainTxt="False" ><![CDATA[Frm_QNXT Homepage_About.Exist]]></Obj>
<Details plainTxt="False" ><![CDATA["Object exists"]]></Details>
<Time><![CDATA[5/13/2022 - 10:40:54]]></Time>
<TimeTick>1652452854</TimeTick>
<NodeArgs eType="Replay" icon="14" nRep="69" >
<Disp><![CDATA[Frm_QNXT Homepage_About.Exist]]></Disp>
<BtmPane vType="Mercury.SSHWeb" >
<Path><![CDATA[ZIP::Act2\Row0\ssf23.xml]]></Path>
<ASHilite><![CDATA[Window("Win QNXT Homepage About").Page("Pge QNXT Homepage About").Frame("Frm QNXT Homepage About")]]></ASHilite>
</BtmPane>
</NodeArgs>
</Step>
<Step rID="T52">
<Obj plainTxt="False" ><![CDATA[Btn_Cancel.Exist]]></Obj>
<Details plainTxt="False" ><![CDATA["Object exists"]]></Details>
<Time><![CDATA[5/13/2022 - 10:40:54]]></Time>
<TimeTick>1652452854</TimeTick>
<NodeArgs eType="Replay" icon="15" nRep="70" >
<Disp><![CDATA[Btn_Cancel.Exist]]></Disp>
<BtmPane vType="Mercury.SSHWeb" >
<Path><![CDATA[ZIP::Act2\Row0\ssf24.xml]]></Path>
<ASHilite><![CDATA[Window("Win QNXT Homepage About").Page("Pge QNXT Homepage About").Frame("Frm QNXT Homepage About").WebButton("Btn Cancel")]]></ASHilite>
</BtmPane>
</NodeArgs>
</Step>
<Step rID="T53">
<Obj plainTxt="False" ><![CDATA[Btn_Cancel.Click]]></Obj>
<Details plainTxt="False" ><![CDATA[]]></Details>
<Time><![CDATA[5/13/2022 - 10:40:56]]></Time>
<TimeTick>1652452856</TimeTick>
<NodeArgs eType="Replay" icon="15" nRep="74" >
<Disp><![CDATA[Btn_Cancel.Click]]></Disp>
<BtmPane vType="Mercury.SSHWeb" >
<Path><![CDATA[ZIP::Act2\Row0\ssf25.xml]]></Path>
<ASHilite><![CDATA[Window("Win QNXT Homepage About").Page("Pge QNXT Homepage About").Frame("Frm QNXT Homepage About").WebButton("Btn Cancel")]]></ASHilite>
</BtmPane>
</NodeArgs>
</Step>
<NodeArgs eType="Context" icon="14" nRep="68" >
<Disp><![CDATA[Frm_QNXT Homepage_About]]></Disp>
<BtmPane vType="Mercury.SSHWeb" >
<Path><![CDATA[ZIP::Act2\Row0\ssf22.xml]]></Path>
<ASHilite><![CDATA[Window("Win QNXT Homepage About").Page("Pge QNXT Homepage About").Frame("Frm QNXT Homepage About")]]></ASHilite>
</BtmPane>
</NodeArgs>
</Step>
<NodeArgs eType="Context" icon="10" nRep="67" >
<Disp><![CDATA[Pge_QNXT Homepage_About]]></Disp>
<BtmPane vType="HTMLSNSH" >
<Path><![CDATA[ZIP::Act2\Row0\ssf21.xml]]></Path>
<ASHilite><![CDATA[Window("Win_QNXT Homepage_About").Page("Pge_QNXT Homepage_About")]]></ASHilite>
</BtmPane>
</NodeArgs>
</Step>
<NodeArgs eType="Context" icon="13" nRep="62" >
<Disp><![CDATA[Win_QNXT Homepage_About]]></Disp>
<BtmPane vType="ViewerGen.SSViewerGen" >
<Path><![CDATA[ZIP::Act2\Row0\ssf18.xml]]></Path>
<ASHilite><![CDATA[9503940]]></ASHilite>
</BtmPane>
</NodeArgs>
</Step>
<Step rID="T54">
<Obj ><![CDATA[Cancel]]></Obj>
<Details ><![CDATA[Succeded at Row No:    914]]></Details>
<Time><![CDATA[5/13/2022 - 10:40:58]]></Time>
<TimeTick>1652452858</TimeTick>
<NodeArgs eType="User" icon="7" nRep="75" Source="Action1 [GlobalDriver_Working_Smoke]" SourceLine="1625" >
<Disp><![CDATA[Cancel]]></Disp>
</NodeArgs>
</Step>
<Step rID="T55">
<Obj plainTxt="False" ><![CDATA[Brw_Home_Page]]></Obj>
<Details plainTxt="False" ><![CDATA[<table><tr><td><span style="text-align : left; font-size : 12px; ">Local Browser</span></td></tr></table>]]></Details>
<Time><![CDATA[5/13/2022 - 10:40:59]]></Time>
<TimeTick>1652452859</TimeTick>
<Step rID="T56">
<Obj plainTxt="False" ><![CDATA[Pge_QNXT_Home_Page]]></Obj>
<Details plainTxt="False" ><![CDATA[Page]]></Details>
<Time><![CDATA[5/13/2022 - 10:40:59]]></Time>
<TimeTick>1652452859</TimeTick>
<Step rID="T57">
<Obj plainTxt="False" ><![CDATA[Lnk_Log_Off.Exist]]></Obj>
<Details plainTxt="False" ><![CDATA["Object exists"]]></Details>
<Time><![CDATA[5/13/2022 - 10:40:59]]></Time>
<TimeTick>1652452859</TimeTick>
<NodeArgs eType="Replay" icon="12" nRep="79" >
<Disp><![CDATA[Lnk_Log_Off.Exist]]></Disp>
<BtmPane vType="Mercury.SSHWeb" >
<Path><![CDATA[ZIP::Act2\Row0\ssf28.xml]]></Path>
<ASHilite><![CDATA[Browser("Brw Home Page").Page("Pge QNXT Home Page").Link("Lnk Log Off")]]></ASHilite>
</BtmPane>
</NodeArgs>
</Step>
<Step rID="T58">
<Obj plainTxt="False" ><![CDATA[Lnk_Log_Off.Click]]></Obj>
<Details plainTxt="False" ><![CDATA[]]></Details>
<Time><![CDATA[5/13/2022 - 10:41:00]]></Time>
<TimeTick>1652452860</TimeTick>
<NodeArgs eType="Replay" icon="12" nRep="82" >
<Disp><![CDATA[Lnk_Log_Off.Click]]></Disp>
<BtmPane vType="Mercury.SSHWeb" >
<Path><![CDATA[ZIP::Act2\Row0\ssf29.xml]]></Path>
<ASHilite><![CDATA[Browser("Brw Home Page").Page("Pge QNXT Home Page").Link("Lnk Log Off")]]></ASHilite>
</BtmPane>
</NodeArgs>
</Step>
<NodeArgs eType="Context" icon="10" nRep="78" >
<Disp><![CDATA[Pge_QNXT_Home_Page]]></Disp>
<BtmPane vType="HTMLSNSH" >
<Path><![CDATA[ZIP::Act2\Row0\ssf27.xml]]></Path>
<ASHilite><![CDATA[Browser("Brw_Home_Page").Page("Pge_QNXT_Home_Page")]]></ASHilite>
</BtmPane>
</NodeArgs>
</Step>
<NodeArgs eType="Context" icon="9" nRep="77" >
<Disp><![CDATA[Brw_Home_Page]]></Disp>
<BtmPane vType="ViewerGen.SSViewerGen" >
<Path><![CDATA[ZIP::Act2\Row0\ssf26.xml]]></Path>
<ASHilite><![CDATA[30279198]]></ASHilite>
</BtmPane>
</NodeArgs>
</Step>
<Step rID="T59">
<Obj ><![CDATA[Log_Off]]></Obj>
<Details ><![CDATA[Succeded at Row No:    7]]></Details>
<Time><![CDATA[5/13/2022 - 10:41:00]]></Time>
<TimeTick>1652452860</TimeTick>